{
  "schema_version": "1.0",
  "case_id": "OD-001",
  "rule_id": "SAFESOC-TRG-OD-001",
  "analytic_family_id": "AF-PROC",
  "analytic_pattern_id": "PROC-01",
  "title": "Volume shadow copies deletion command",
  "formalisation_timing": "retrospective_pre_extension_audit",
  "rule_origin": {
    "type": "project_analytic",
    "reference": "queries/retrieval_spec.md (Q1/main-alert analytic); executable form formalised under alert-anchor policy v1.0"
  },
  "scope": {
    "basis": "declared_asset_scope",
    "complete_legal_scope": true,
    "description": "All events in the configured raw source after any pre-existing host and sensor scope is applied."
  },
  "event_predicate": {
    "all": [
      {
        "field": "event_code",
        "op": "eq",
        "value": 1
      },
      {
        "field": "attributes.image",
        "op": "iendswith",
        "value": "\\vssadmin.exe"
      },
      {
        "field": "attributes.command_line",
        "op": "regex",
        "value": "(?i)\\bdelete\\s+shadows\\b"
      },
      {
        "field": "attributes.command_line",
        "op": "icontains",
        "value": "/all"
      }
    ]
  },
  "selection": {
    "strategy": "earliest_match"
  },
  "expected_a0": {
    "record_key": "sysmon:290147"
  },
  "rationale": "A command requesting deletion of all volume shadow copies is a stable destructive-impact alert surface."
}
