{
  "schema_version": "1.0",
  "case_id": "PS-002",
  "rule_id": "SAFESOC-TRG-PS-002",
  "analytic_family_id": "AF-PROC",
  "analytic_pattern_id": "PROC-02",
  "title": "Hidden PowerShell download through WebClient",
  "formalisation_timing": "retrospective_pre_extension_audit",
  "rule_origin": {
    "type": "project_analytic",
    "reference": "queries/retrieval_spec.md (Q1/main-alert analytic); executable form formalised under alert-anchor policy v1.0"
  },
  "scope": {
    "basis": "full_source",
    "complete_legal_scope": true,
    "description": "All events in the configured raw source; no event-level answer selector is applied."
  },
  "event_predicate": {
    "all": [
      {
        "field": "event_code",
        "op": "eq",
        "value": 1
      },
      {
        "field": "attributes.image",
        "op": "iendswith",
        "value": "\\powershell.exe"
      },
      {
        "field": "attributes.command_line",
        "op": "regex",
        "value": "(?i)-WindowStyle\\s+hidden"
      },
      {
        "field": "attributes.command_line",
        "op": "icontains",
        "value": "Net.WebClient"
      },
      {
        "field": "attributes.command_line",
        "op": "icontains",
        "value": "DownloadFile"
      }
    ]
  },
  "selection": {
    "strategy": "earliest_match"
  },
  "expected_a0": {
    "record_key": "14032"
  },
  "rationale": "Hidden PowerShell using WebClient.DownloadFile is a stable ingress and script-execution alert surface."
}
