{
  "schema_version": "1.0",
  "case_id": "ACCT-001",
  "rule_id": "SAFESOC-TRG-ACCT-001",
  "analytic_family_id": "AF-PROC",
  "analytic_pattern_id": "PROC-01",
  "title": "Local account creation command",
  "formalisation_timing": "retrospective_pre_extension_audit",
  "rule_origin": {
    "type": "project_analytic",
    "reference": "queries/retrieval_spec.md (Q1/main-alert analytic); executable form formalised under alert-anchor policy v1.0"
  },
  "scope": {
    "basis": "full_source",
    "complete_legal_scope": true,
    "description": "All events in the configured raw source; no event-level answer selector is applied."
  },
  "event_predicate": {
    "all": [
      {
        "field": "event_code",
        "op": "eq",
        "value": 1
      },
      {
        "field": "attributes.command_line",
        "op": "regex",
        "value": "(?i)\\bnet(?:\\.exe)?\\s+user\\s+(?:/add\\s+\\S+|\\S+\\s+\\S+\\s+/add)"
      }
    ]
  },
  "selection": {
    "strategy": "earliest_match"
  },
  "expected_a0": {
    "record_key": "4218"
  },
  "rationale": "A process command line requesting local account creation is a reproducible account-persistence alert surface."
}
