{
  "schema_version": "1.0",
  "case_id": "UAC-001",
  "rule_id": "SAFESOC-TRG-UAC-001",
  "analytic_family_id": "AF-PROC",
  "analytic_pattern_id": "PROC-03",
  "title": "High-integrity sdclt process launched from a shell",
  "formalisation_timing": "retrospective_pre_extension_audit",
  "rule_origin": {
    "type": "project_analytic",
    "reference": "queries/retrieval_spec.md (Q1/main-alert analytic); executable form formalised under alert-anchor policy v1.0"
  },
  "scope": {
    "basis": "declared_asset_scope",
    "complete_legal_scope": true,
    "description": "All events in the configured raw source after any pre-existing host and sensor scope is applied."
  },
  "event_predicate": {
    "all": [
      {
        "field": "event_code",
        "op": "eq",
        "value": 1
      },
      {
        "field": "attributes.image",
        "op": "iendswith",
        "value": "\\sdclt.exe"
      },
      {
        "field": "attributes.integrity_level",
        "op": "ieq",
        "value": "High"
      },
      {
        "field": "attributes.parent_image",
        "op": "regex",
        "value": "(?i)\\\\(cmd|powershell)\\.exe$"
      }
    ]
  },
  "selection": {
    "strategy": "earliest_match"
  },
  "expected_a0": {
    "record_key": "348988"
  },
  "rationale": "A high-integrity sdclt process launched from a command shell is a reproducible UAC-bypass alert surface."
}
